Pregunta,Respuesta,Categoría,Fuente
"¿Qué regula el Reglamento de Ingreso, Promoción y Ratificación Docente de la UPAO?","Regula los procesos para la incorporación, ascenso y evaluación periódica del personal docente ordinario y contratado en la universidad.",Marco normativo,"Reglamento de Ingreso, Promoción y Ratificación Docente (Art. 1)"
¿Qué tipos de concursos existen para el ingreso docente?,"Concurso público de méritos y concurso interno, según la categoría y modalidad de la plaza docente convocada.",Ingreso docente,"Reglamento de Ingreso, Promoción y Ratificación Docente (Art. 7)"
¿Qué requisitos se exigen para postular a una plaza docente ordinaria?,"Título profesional, grado académico de maestro o doctor, experiencia profesional y docente mínima, según la categoría.",Requisitos,"Reglamento de Ingreso, Promoción y Ratificación Docente (Art. 10)"
¿Cuáles son las categorías del docente ordinario en la UPAO?,"Auxiliar, Asociado y Principal, cada una con requisitos y funciones específicas.",Categorías docentes,"Reglamento de Ingreso, Promoción y Ratificación Docente (Art. 5)"
¿Qué debe incluir el expediente del postulante?,"Hoja de vida, constancias, certificados, DNI, títulos, y documentos que acrediten experiencia y méritos.",Postulación,"Reglamento de Ingreso, Promoción y Ratificación Docente (Art. 13)"
¿Qué es la ratificación docente?,Es un proceso periódico para evaluar el desempeño docente y renovar su condición de ordinario.,Ratificación,"Reglamento de Ingreso, Promoción y Ratificación Docente (Art. 28)"
¿Qué criterios se consideran para la ratificación?,"Evaluación docente, producción académica, participación en gestión institucional, y cumplimiento ético y disciplinario.",Evaluación,"Reglamento de Ingreso, Promoción y Ratificación Docente (Art. 29)"
¿Qué duración tiene el contrato de docentes a tiempo completo?,"Es de un año, renovable hasta por tres años según evaluación positiva.",Contratación,"Reglamento de Ingreso, Promoción y Ratificación Docente (Art. 41)"
¿Qué es la promoción docente?,Proceso mediante el cual un docente asciende de categoría según su evaluación y cumplimiento de requisitos.,Promoción,"Reglamento de Ingreso, Promoción y Ratificación Docente (Art. 35)"
¿Qué funciones tiene el comité de evaluación docente?,"Revisar expedientes, aplicar criterios de evaluación, y emitir informes sobre ingreso, promoción o ratificación.",Evaluación,"Reglamento de Ingreso, Promoción y Ratificación Docente (Art. 21)"
"¿Qué regula el Reglamento de Ingreso, Promoción y Ratificación Docente de la UPAO?","Regula los procesos para la incorporación, ascenso y evaluación periódica del personal docente ordinario y contratado en la universidad.",Marco normativo,"Reglamento de Ingreso, Promoción y Ratificación Docente (Art. 1)"
¿Qué tipos de concursos existen para el ingreso docente?,"Concurso público de méritos y concurso interno, según la categoría y modalidad de la plaza docente convocada.",Ingreso docente,"Reglamento de Ingreso, Promoción y Ratificación Docente (Art. 7)"
¿Qué requisitos se exigen para postular a una plaza docente ordinaria?,"Título profesional, grado académico de maestro o doctor, experiencia profesional y docente mínima, según la categoría.",Requisitos,"Reglamento de Ingreso, Promoción y Ratificación Docente (Art. 10)"
¿Cuáles son las categorías del docente ordinario en la UPAO?,"Auxiliar, Asociado y Principal, cada una con requisitos y funciones específicas.",Categorías docentes,"Reglamento de Ingreso, Promoción y Ratificación Docente (Art. 5)"
¿Qué debe incluir el expediente del postulante?,"Hoja de vida, constancias, certificados, DNI, títulos, y documentos que acrediten experiencia y méritos.",Postulación,"Reglamento de Ingreso, Promoción y Ratificación Docente (Art. 13)"
¿Qué es la ratificación docente?,Es un proceso periódico para evaluar el desempeño docente y renovar su condición de ordinario.,Ratificación,"Reglamento de Ingreso, Promoción y Ratificación Docente (Art. 28)"
¿Qué criterios se consideran para la ratificación?,"Evaluación docente, producción académica, participación en gestión institucional, y cumplimiento ético y disciplinario.",Evaluación,"Reglamento de Ingreso, Promoción y Ratificación Docente (Art. 29)"
¿Qué duración tiene el contrato de docentes a tiempo completo?,"Es de un año, renovable hasta por tres años según evaluación positiva.",Contratación,"Reglamento de Ingreso, Promoción y Ratificación Docente (Art. 41)"
¿Qué es la promoción docente?,Proceso mediante el cual un docente asciende de categoría según su evaluación y cumplimiento de requisitos.,Promoción,"Reglamento de Ingreso, Promoción y Ratificación Docente (Art. 35)"
¿Qué funciones tiene el comité de evaluación docente?,"Revisar expedientes, aplicar criterios de evaluación, y emitir informes sobre ingreso, promoción o ratificación.",Evaluación,"Reglamento de Ingreso, Promoción y Ratificación Docente (Art. 21)"
"¿Qué regula el Reglamento de Ingreso, Promoción y Ratificación Docente de la UPAO?","Regula los procesos para la incorporación, ascenso y evaluación periódica del personal docente ordinario y contratado en la universidad.",Marco normativo,"Reglamento de Ingreso, Promoción y Ratificación Docente (Art. 1)"
¿Qué tipos de concursos existen para el ingreso docente?,"Concurso público de méritos y concurso interno, según la categoría y modalidad de la plaza docente convocada.",Ingreso docente,"Reglamento de Ingreso, Promoción y Ratificación Docente (Art. 7)"
¿Qué requisitos se exigen para postular a una plaza docente ordinaria?,"Título profesional, grado académico de maestro o doctor, experiencia profesional y docente mínima, según la categoría.",Requisitos,"Reglamento de Ingreso, Promoción y Ratificación Docente (Art. 10)"
¿Cuáles son las categorías del docente ordinario en la UPAO?,"Auxiliar, Asociado y Principal, cada una con requisitos y funciones específicas.",Categorías docentes,"Reglamento de Ingreso, Promoción y Ratificación Docente (Art. 5)"
¿Qué debe incluir el expediente del postulante?,"Hoja de vida, constancias, certificados, DNI, títulos, y documentos que acrediten experiencia y méritos.",Postulación,"Reglamento de Ingreso, Promoción y Ratificación Docente (Art. 13)"
¿Qué es la ratificación docente?,Es un proceso periódico para evaluar el desempeño docente y renovar su condición de ordinario.,Ratificación,"Reglamento de Ingreso, Promoción y Ratificación Docente (Art. 28)"
¿Qué criterios se consideran para la ratificación?,"Evaluación docente, producción académica, participación en gestión institucional, y cumplimiento ético y disciplinario.",Evaluación,"Reglamento de Ingreso, Promoción y Ratificación Docente (Art. 29)"
¿Qué duración tiene el contrato de docentes a tiempo completo?,"Es de un año, renovable hasta por tres años según evaluación positiva.",Contratación,"Reglamento de Ingreso, Promoción y Ratificación Docente (Art. 41)"
¿Qué es la promoción docente?,Proceso mediante el cual un docente asciende de categoría según su evaluación y cumplimiento de requisitos.,Promoción,"Reglamento de Ingreso, Promoción y Ratificación Docente (Art. 35)"
¿Qué funciones tiene el comité de evaluación docente?,"Revisar expedientes, aplicar criterios de evaluación, y emitir informes sobre ingreso, promoción o ratificación.",Evaluación,"Reglamento de Ingreso, Promoción y Ratificación Docente (Art. 21)"
¿Qué contiene el Anexo del Convenio de Modalidades Formativas Laborales?,"Incluye un plan específico de aprendizaje, datos de la empresa, del beneficiario y del Centro de Formación Profesional, además de los objetivos, actividades, competencias y evaluación.",Generalidades,Anexo Convenio Modalidades Formativas Laborales
¿Qué datos generales se registran sobre el beneficiario?,"Nombres y apellidos, monto de subvención, tipo de seguro, jornada formativa y puesto de trabajo.",Beneficiario,Anexo Convenio Modalidades Formativas Laborales
¿Qué tipo de jornada se especifica en el plan?,La jornada formativa incluye el horario en que el beneficiario desarrollará sus actividades.,Jornada formativa,Anexo Convenio Modalidades Formativas Laborales
¿Qué información se debe incluir en el objetivo del plan?,"Los objetivos que el beneficiario debe lograr, alineados con la Ley N.º 28518.",Objetivos,Anexo Convenio Modalidades Formativas Laborales
¿Qué actividades formativas se desarrollan en la empresa?,"Incluyen funciones principales del puesto, tareas específicas y competencias a desarrollar.",Actividades,Anexo Convenio Modalidades Formativas Laborales
¿Qué son las competencias específicas?,Son habilidades técnicas directamente relacionadas al puesto que el beneficiario desarrollará.,Competencias específicas,Anexo Convenio Modalidades Formativas Laborales
¿Qué son las competencias genéricas o transversales?,"Son comportamientos y actitudes como trabajo en equipo, comunicación, responsabilidad, etc.",Competencias genéricas,Anexo Convenio Modalidades Formativas Laborales
¿Qué información contiene la sección de duración?,Incluye la fecha de inicio y término del plan formativo.,Duración,Anexo Convenio Modalidades Formativas Laborales
¿Qué se detalla en el contexto formativo?,"Infraestructura, maquinaria, herramientas, insumos, equipo personal y condiciones de seguridad.",Contexto formativo,Anexo Convenio Modalidades Formativas Laborales
¿Qué es el mapa de recorrido en la empresa?,Una relación de áreas o departamentos donde rotará el beneficiario durante su formación.,Recorrido,Anexo Convenio Modalidades Formativas Laborales
¿Cómo se monitorea y evalúa al beneficiario?,"Mediante evaluación personal, observación de actividades, aportes a la empresa y otros criterios.",Evaluación,Anexo Convenio Modalidades Formativas Laborales
¿Qué criterios se utilizan en la evaluación de actividades formativas?,"Calidad, pertinencia y resultados de la actividad formativa.",Evaluación,Anexo Convenio Modalidades Formativas Laborales
¿Qué roles se identifican en el plan?,"El beneficiario, la empresa, y el responsable del Centro de Formación Profesional.",Participantes,Anexo Convenio Modalidades Formativas Laborales
¿Qué compromisos asumen los firmantes del anexo?,Cumplir con la ejecución del plan formativo y los compromisos establecidos.,Compromisos,Anexo Convenio Modalidades Formativas Laborales
¿Qué debe incluirse en las condiciones pactadas?,"Monto de subvención, tipo de seguro, jornada y ocupación a desarrollar.",Condiciones,Anexo Convenio Modalidades Formativas Laborales
¿Cuál es la función principal de las actividades formativas?,Contribuir al desarrollo de habilidades prácticas vinculadas al puesto de trabajo.,Finalidad,Anexo Convenio Modalidades Formativas Laborales
¿Quién es responsable de la formación dentro de la empresa?,Una persona designada específicamente para orientar al beneficiario.,Formador,Anexo Convenio Modalidades Formativas Laborales
¿Qué tipo de indicadores se deben definir en las competencias?,Indicadores de logro que midan el desempeño esperado del beneficiario.,Indicadores,Anexo Convenio Modalidades Formativas Laborales
¿Es obligatorio que el beneficiario participe en la evaluación?,"Sí, debe realizar una autoevaluación en relación con sus competencias desarrolladas.",Evaluación personal,Anexo Convenio Modalidades Formativas Laborales
¿Qué recursos deben estar disponibles para la formación?,"Equipos, herramientas, insumos y condiciones adecuadas de seguridad.",Recursos,Anexo Convenio Modalidades Formativas Laborales
¿Qué busca esta directiva académica?,"Garantizar la organización y ejecución adecuada de las actividades académicas no presenciales en la universidad, especialmente durante situaciones excepcionales.",Objetivo,Directiva Académica (Art. 1)
¿A quiénes aplica esta directiva?,"A todas las facultades, escuelas profesionales, programas de estudios y unidades académicas de la universidad.",Ámbito de aplicación,Directiva Académica (Art. 2)
¿Qué modalidades de enseñanza contempla?,"Incluye educación no presencial, educación virtual y el uso de tecnologías de la información.",Modalidades,Directiva Académica (Art. 3)
¿Qué herramientas digitales deben usar los docentes?,"Plataformas educativas virtuales oficiales como el aula virtual de la UPAO, correo institucional y otras aprobadas por la universidad.",Tecnología,Directiva Académica (Art. 6)
¿Qué rol tiene el docente en la enseñanza virtual?,"Planifica, orienta, acompaña y evalúa el aprendizaje de los estudiantes, adaptando estrategias a la virtualidad.",Funciones del docente,Directiva Académica (Art. 7)
¿Cómo deben evaluarse los aprendizajes?,"A través de instrumentos digitales que permitan evidenciar el logro de competencias, con criterios claros y objetivos.",Evaluación,Directiva Académica (Art. 8)
¿Qué debe contener el sílabo en modalidad virtual?,"Resultados de aprendizaje, estrategias, cronograma de actividades, métodos de evaluación y bibliografía.",Planificación,Directiva Académica (Art. 9)
¿Qué pasa si el estudiante no puede conectarse a clases?,Debe justificar su inasistencia y tendrá mecanismos de recuperación definidos por la escuela profesional.,Asistencia,Directiva Académica (Art. 11)
¿Quién supervisa el cumplimiento de esta directiva?,El Vicerrectorado Académico y la Dirección de Escuela correspondiente supervisan su implementación.,Supervisión,Directiva Académica (Art. 13)
¿Qué valores se promueven en la educación virtual?,"Responsabilidad, ética, respeto, puntualidad, integridad académica y compromiso con el aprendizaje.",Valores,Directiva Académica (Art. 14)
¿Qué requisitos debo cumplir para solicitar la reserva de matrícula?,"Para solicitar la reserva de matrícula en UPAO, puedes hacerlo de manera ordinaria dentro de los primeros 30 días de clases o de manera extraordinaria por motivos de salud debidamente acreditados. En ambos casos, debes estar al día en tus pagos y presentar la solicitud por la Plataforma de Atención al Usuario, incluyendo los requisitos normativos y recibos de pago correspondientes. Si estás en la Filial Piura, el trámite se canaliza a través de la Oficina de Gestión Académica.",Reserva de matrícula,Directiva Académica - Numeral 5.8
¿Puedo anular mi matrícula en una asignatura después de la fecha límite?,"Sí, de forma excepcional, puedes solicitar el retiro de una o más asignaturas después de la fecha límite, siempre que presentes razones justificadas y documentadas. Esta solicitud debe hacerse antes del primer parcial y no aplica si tienes rendimiento desaprobatorio hasta la fecha de la solicitud. La decisión la toma el director de escuela y, de ser aprobada, se anula automáticamente el registro de matrícula.",Retiro de asignaturas,Directiva Académica - Numeral 5.9
¿Qué condiciones debo cumplir para dar un examen sustitutorio?,"Tienes derecho a rendir un examen sustitutorio si has desaprobado una asignatura o deseas mejorar tu promedio promocional, siempre que tu nota promocional sea 7 o más. Este examen reemplaza la nota del examen parcial o final que más te favorezca y no puede ser anulado una vez rendido. Debes realizar los pagos correspondientes y el examen abarcará todo el contenido de la asignatura.",Evaluación,Directiva Académica - Numeral 5.18
¿En qué consiste la convalidación de asignaturas en UPAO?,La convalidación es un proceso mediante el cual UPAO reconoce asignaturas aprobadas en otra universidad o por traslado interno. Procede si la asignatura tiene igual número de créditos y al menos el 80% del contenido equivalente. El trámite incluye una evaluación por la escuela profesional y resolución del decano. En Medicina Humana se deben cursar mínimo 8 semestres en UPAO.,Convalidaciones,Directiva Académica - Numeral 5.5
¿Qué pasa si desapruebo una asignatura por tercera vez?,"Si desapruebas tres veces una misma asignatura, eres separado automáticamente de forma definitiva de la universidad. No se permite continuar con la carrera profesional ni el ingreso mediante examen de admisión para esa carrera.",Separación definitiva,Directiva Académica - Numeral 5.10
¿Qué requisitos debo cumplir para solicitar un traslado externo?,"Para solicitar un traslado externo a UPAO, necesitas presentar varios documentos como el certificado de estudios legalizado, constancia de promedio ponderado, de matrícula, de ingreso, copia del DNI y comprobante de pago. Si el traslado es internacional, debes incluir documentación visada por la universidad de origen y la embajada respectiva.",Traslados,Directiva Académica - Numeral 5.4
¿Puedo registrarme en una asignatura adicional si ya cumplí mi carga académica?,"Sí, si tu promedio ponderado semestral es igual o mayor a 14, con carga completa y sin adeudar cursos anteriores, puedes solicitar una asignatura adicional. Esta solicitud se hace vía campus virtual y debe ser aprobada por el director de escuela. El crédito adicional genera un pago adicional en tu estado de cuenta.",Matrícula,Directiva Académica - Numeral 5.7
¿Qué es el programa de complementación y nivelación académica?,"Es un programa que permite a los estudiantes reforzar conocimientos mediante asignaturas adicionales, con una matrícula máxima de 12 créditos. Estas asignaturas deben tener un mínimo de 20 inscritos y el costo se determina por créditos. Si no se completa el mínimo, los estudiantes pueden asumir el costo restante entre ellos con un compromiso de pago firmado.",Programas académicos,Directiva Académica - Numeral 5.15
¿Qué ocurre si no asisto a una evaluación parcial o final?,"Si no asistes a una evaluación, puedes solicitar una evaluación de rezagados hasta 2 días hábiles después (parcial) o un día hábil después (final), justificando tu inasistencia. El director de escuela evaluará tu solicitud y, si es aceptada, el docente fijará la nueva fecha de examen en un máximo de 5 días hábiles (parcial) o 2 días (final).",Evaluación,Directiva Académica - Numeral 5.17
¿Qué pasos debo seguir para reanudar mis estudios si dejé la universidad?,"Puedes reanudar tus estudios si tu inactividad fue menor a 3 años, haciendo el trámite en la Plataforma de Atención al Usuario. Si ha pasado más tiempo, se evalúa tu caso de forma excepcional. No se convalidan cursos llevados en otras universidades durante tu ausencia. El decano resolverá la solicitud e informará a la Oficina de Evaluación Académica.",Reanudación de estudios,Directiva Académica - Numeral 5.6
¿Qué debo hacer si deseo realizar un traslado interno a otra carrera en UPAO?,"Para realizar un traslado interno debes haber cursado y aprobado como mínimo 36 créditos en tu carrera actual, estar en situación académica y administrativa regular, y presentar tu solicitud formal en la Plataforma de Atención al Usuario. El decano resolverá la solicitud previa evaluación de la nueva escuela profesional.",Traslados,Directiva Académica - Numeral 5.3
¿Cuántas veces puedo repetir una asignatura en UPAO?,Solo puedes desaprobar una asignatura hasta en dos oportunidades. En la tercera desaprobación se produce la separación definitiva de la universidad. Se recomienda acudir a tutorías y reforzamiento académico si se tiene dificultad en alguna materia.,Evaluación,Directiva Académica - Numeral 5.10
¿Qué requisitos existen para acceder a la matrícula condicional?,"La matrícula condicional es otorgada a estudiantes que, por disposición académica, están en condición de ser separados. Pueden solicitarla excepcionalmente y es evaluada por el decano. Esta matrícula permite continuar por un ciclo más bajo ciertas condiciones académicas.",Matrícula,Directiva Académica - Numeral 5.2
¿Puedo llevar cursos adelantados de ciclos superiores?,"Sí, puedes adelantar cursos si tienes promedio ponderado igual o superior a 14, cumples con los prerrequisitos, y no tienes cursos pendientes de ciclos anteriores. La solicitud debe hacerse por el campus virtual y es evaluada por el director de escuela.",Matrícula,Directiva Académica - Numeral 5.7
¿Qué procedimiento debo seguir para el retiro total del semestre?,"Puedes solicitar el retiro total antes de la evaluación final, por motivos académicos o personales debidamente sustentados. Esta solicitud se presenta por la plataforma virtual o presencialmente, y requiere estar al día en tus obligaciones académicas y financieras.",Retiro de ciclo,Directiva Académica - Numeral 5.9
¿Se puede modificar la matrícula después de haber sido registrada?,"Sí, puedes realizar modificaciones en tu matrícula durante el periodo de matrícula extraordinaria. Estas incluyen retiros o adición de asignaturas. Después de este plazo, solo se permite el retiro excepcional con justificación.",Matrícula,Directiva Académica - Numeral 5.2
¿Cómo se evalúa el aprendizaje durante el semestre?,"El aprendizaje se evalúa a través de evaluaciones continuas, parciales y finales. Las ponderaciones varían según el sílabo de cada asignatura. Debes cumplir con los trabajos, exposiciones, prácticas y exámenes programados. La nota mínima aprobatoria es 11.",Evaluación,Directiva Académica - Numeral 5.16
¿Qué sucede si no cumplo con la asistencia mínima?,"Si no cumples con la asistencia mínima del 70% en una asignatura, quedarás desaprobado automáticamente, independientemente de tus calificaciones. Es importante asistir regularmente a clases y justificar ausencias prolongadas.",Evaluación,Directiva Académica - Numeral 5.16
¿Qué documentación necesito para postular al programa de complementación académica?,"Debes presentar tu ficha de matrícula, constancia de notas, copia de DNI y recibo de pago. Las asignaturas se ofrecen según disponibilidad y demanda estudiantil. Debes tener en cuenta el límite de créditos permitido.",Programas académicos,Directiva Académica - Numeral 5.15
¿Quién autoriza el examen sustitutorio y cómo se presenta la solicitud?,"El examen sustitutorio debe ser autorizado por el director de escuela, previa presentación de la solicitud por el estudiante. Este trámite incluye el pago correspondiente y la revisión del cumplimiento de requisitos académicos. La evaluación es integral y solo puede rendirse una vez.",Evaluación,Directiva Académica - Numeral 5.18
¿Quiénes firman el convenio de prácticas profesionales en el sector público?,"El convenio lo firman el egresado, la entidad pública representada por una autoridad competente, y se formaliza en un número definido de ejemplares.",Partes del convenio,Modelo de Convenio Prácticas Profesionales SECTOR PÚBLICO (Intro)
¿Por qué se hace este convenio?,Para que el egresado aplique sus conocimientos en un entorno real y obtenga experiencia práctica que lo ayude a conseguir su título o grado.,Finalidad,Modelo de Convenio Prácticas Profesionales SECTOR PÚBLICO (Cláusula Segunda)
¿Dónde se realizan las prácticas?,"En un área específica de la entidad pública, cuya dirección debe estar registrada en el convenio.",Lugar,Modelo de Convenio Prácticas Profesionales SECTOR PÚBLICO (Cláusula Tercera)
¿Cuánto tiempo duran las prácticas?,El plazo se define en meses y se establece una fecha de inicio y fin acordada por las partes.,Duración,Modelo de Convenio Prácticas Profesionales SECTOR PÚBLICO (Cláusula Cuarta)
¿Cuántos días a la semana se deben hacer las prácticas?,"Se especifica la frecuencia semanal y el horario de ingreso y salida, con posibilidad de ajustes en coordinación.",Horario,Modelo de Convenio Prácticas Profesionales SECTOR PÚBLICO (Cláusula Quinta)
¿Qué debe garantizar la entidad pública al practicante?,"Pago puntual, cobertura de salud y accidentes, emisión de informes y certificado, y protección ante hostigamiento sexual.",Obligaciones de la entidad,Modelo de Convenio Prácticas Profesionales SECTOR PÚBLICO (Cláusula Sexta)
¿Qué debe cumplir el egresado durante las prácticas?,"Debe ser responsable, respetar las normas internas y cumplir con las tareas asignadas.",Obligaciones del practicante,Modelo de Convenio Prácticas Profesionales SECTOR PÚBLICO (Cláusula Séptima)
¿Qué cosas no puede hacer el practicante?,"No debe aceptar regalos, divulgar información confidencial ni hacer actividades políticas en horario de prácticas.",Prohibiciones,Modelo de Convenio Prácticas Profesionales SECTOR PÚBLICO (Cláusula Octava)
¿Este convenio me convierte en trabajador de la entidad pública?,"No, este convenio no crea vínculo laboral ni otorga beneficios sociales como un contrato de trabajo.",Naturaleza legal,Modelo de Convenio Prácticas Profesionales SECTOR PÚBLICO (Cláusula Novena)
¿Qué monto se paga como subvención económica?,Se otorga una subvención mensual que puede ajustarse según la RMV vigente y está sujeta a retenciones si el practicante lo desea.,Subvención económica,Modelo de Convenio Prácticas Profesionales SECTOR PÚBLICO (Cláusula Décima)
¿Puedo retirarme de las prácticas si lo deseo?,"Sí, puedes retirarte avisando con 15 días hábiles de anticipación, salvo excepciones donde el plazo puede ser menor.",Desvinculación,Modelo de Convenio Prácticas Profesionales SECTOR PÚBLICO (Cláusula Décimo Primera)
¿Qué es la movilidad académica docente según la UPAO?,Es el desplazamiento temporal de docentes hacia o desde instituciones con convenio con la UPAO para fortalecer sus capacidades mediante actividades de enseñanza y aprendizaje.,Definición,Reglamento de Movilidad Académica de Docentes (Art. 1-2)
